{"$id":"https://example.invalid/ssot-registry/release.snapshot.schema.json","$schema":"https://json-schema.org/draft/2020-12/schema","properties":{"boundaries":{"items":{"type":"object"},"type":"array"},"boundary":{"type":["object","null"]},"claims":{"items":{"type":"object"},"type":"array"},"evidence":{"items":{"type":"object"},"type":"array"},"features":{"items":{"type":"object"},"type":"array"},"file_hashes":{"type":"object"},"generated_at":{"type":"string"},"kind":{"const":"release_snapshot"},"profile_evaluations":{"items":{"type":"object"},"type":"array"},"profiles":{"items":{"type":"object"},"type":"array"},"registry_path":{"type":"string"},"registry_sha256":{"type":"string"},"release":{"properties":{"boundary_id":{"type":"string"},"boundary_ids":{"items":{"type":"string"},"type":"array"},"claim_ids":{"items":{"type":"string"},"type":"array"},"evidence_ids":{"items":{"type":"string"},"type":"array"},"id":{"type":"string"},"status":{"type":"string"},"version":{"type":"string"}},"required":["id","version","status","boundary_id","boundary_ids","claim_ids","evidence_ids"],"type":"object"},"schema_version":{"type":"integer"},"summary":{"properties":{"boundary_count":{"type":"integer"},"boundary_id":{"type":["string","null"]},"boundary_ids":{"items":{"type":"string"},"type":"array"},"claim_count":{"type":"integer"},"evidence_count":{"type":"integer"},"feature_count":{"type":"integer"},"profile_count":{"type":"integer"},"release_id":{"type":"string"},"status":{"type":"string"},"test_count":{"type":"integer"},"version":{"type":"string"}},"required":["release_id","version","boundary_id","boundary_ids","boundary_count","feature_count","profile_count","claim_count","test_count","evidence_count","status"],"type":"object"},"tests":{"items":{"type":"object"},"type":"array"}},"required":["schema_version","kind","generated_at","registry_path","registry_sha256","release","boundary","boundaries","features","profiles","profile_evaluations","claims","tests","evidence","file_hashes","summary"],"type":"object"}