{"boundaries":[{"feature_ids":["feat:graph.lineage-cli-current-viewer-payload"],"frozen":true,"id":"bnd:graph.lineage-cli-current-viewer-payload.2026-06-29","profile_ids":[],"status":"frozen","title":"Lineage graph CLI current viewer payload boundary"}],"boundary":{"feature_ids":["feat:graph.lineage-cli-current-viewer-payload"],"frozen":true,"id":"bnd:graph.lineage-cli-current-viewer-payload.2026-06-29","profile_ids":[],"status":"frozen","title":"Lineage graph CLI current viewer payload boundary"},"claims":[{"depends_on_claim_ids":["clm:graph.lineage-cli-current-viewer-payload.t0","clm:graph.lineage-cli-current-viewer-payload.t1","clm:graph.lineage-cli-current-viewer-payload.t2"],"description":"T3 scaffold claim for feat:graph.lineage-cli-current-viewer-payload.","evidence_ids":["evd:t3.graph.lineage-cli-current-viewer-payload.proof-graph"],"feature_ids":["feat:graph.lineage-cli-current-viewer-payload"],"id":"clm:graph.lineage-cli-current-viewer-payload.t3","kind":"runtime","origin":"ssot-core","status":"promoted","test_ids":["tst:pytest.graph.lineage-cli-current-viewer-payload.t3.proof-graph"],"tier":"T3","title":"Lineage graph CLI emits current viewer payload T3 claim"}],"evidence":[{"body":"Planned scaffold evidence for feat:graph.lineage-cli-current-viewer-payload.","claim_ids":["clm:graph.lineage-cli-current-viewer-payload.t3","clm:graph.lineage-cli-current-viewer-payload.t0","clm:graph.lineage-cli-current-viewer-payload.t1","clm:graph.lineage-cli-current-viewer-payload.t2"],"id":"evd:t3.graph.lineage-cli-current-viewer-payload.proof-graph","kind":"bundle","origin":"ssot-core","path":".ssot/evidence/graph.lineage-cli-current-viewer-payload/proof-graph-t3.json","release_context":{"blocking_issue_result":"clear","blocking_risk_result":"clear","boundary_id":"bnd:graph.lineage-cli-current-viewer-payload.2026-06-29","boundary_ids":["bnd:graph.lineage-cli-current-viewer-payload.2026-06-29"],"release_id":"rel:graph.lineage-cli-current-viewer-payload.2026-06-29","verification_report_result":"certified"},"robustness_dimensions":["unit","integration","release-workflow","offline-portability"],"source_evidence_ids":["evd:t1.graph.lineage-cli-current-viewer-payload.proof-graph-source"],"status":"passed","test_ids":["tst:pytest.graph.lineage-cli-current-viewer-payload.t0.proof-graph","tst:pytest.graph.lineage-cli-current-viewer-payload.t1.proof-graph","tst:pytest.graph.lineage-cli-current-viewer-payload.t2.proof-graph","tst:pytest.graph.lineage-cli-current-viewer-payload.t3.proof-graph"],"tier":"T3","title":"Lineage graph CLI emits current viewer payload proof-graph scaffold evidence"}],"features":[{"body":null,"claim_ids":["clm:graph.lineage-cli-current-viewer-payload.t0","clm:graph.lineage-cli-current-viewer-payload.t1","clm:graph.lineage-cli-current-viewer-payload.t2","clm:graph.lineage-cli-current-viewer-payload.t3"],"description":"The CLI HTML lineage export embeds the current vendored React lineage graph viewer, removes the stale inline fallback, emits the current v2 payload metadata shape, and gates release workflows against stale vendored assets.","id":"feat:graph.lineage-cli-current-viewer-payload","implementation_status":"implemented","lifecycle":{"note":null,"replacement_feature_ids":[],"stage":"active"},"origin":"ssot-core","parent_feature_ids":[],"plan":{"horizon":"current","slot":null,"target_claim_tier":"T3","target_lifecycle_stage":"active"},"requires":[],"spec_ids":[],"test_ids":["tst:pytest.graph.lineage-cli-current-viewer-payload.t0.proof-graph","tst:pytest.graph.lineage-cli-current-viewer-payload.t1.proof-graph","tst:pytest.graph.lineage-cli-current-viewer-payload.t2.proof-graph","tst:pytest.graph.lineage-cli-current-viewer-payload.t3.proof-graph"],"title":"Lineage graph CLI emits current viewer payload"}],"file_hashes":{".ssot/evidence/graph.lineage-cli-current-viewer-payload/proof-graph-t3.json":"d04d1dc9fd72ef16b31c4672d8661cdf6ecd36e3853dbd5380e7cf45d8ebe09e","tests/ssot_scaffold/test_graph_lineage_cli_current_viewer_payload_t3_proof_graph.py":"647fd6fb6e681d0847b989bb341fcb94f7f80e5b37f4bdc47c6e063b1a935013"},"generated_at":"2026-06-30T04:55:01Z","kind":"release_snapshot","profile_evaluations":[],"profiles":[],"registry_path":".ssot/registry.json","registry_sha256":"9004215970e5bd508826b158c8abc2e473806db6d18ae2e29ee3288cb59ff490","release":{"boundary_id":"bnd:graph.lineage-cli-current-viewer-payload.2026-06-29","boundary_ids":["bnd:graph.lineage-cli-current-viewer-payload.2026-06-29"],"claim_ids":["clm:graph.lineage-cli-current-viewer-payload.t3"],"evidence_ids":["evd:t3.graph.lineage-cli-current-viewer-payload.proof-graph"],"id":"rel:graph.lineage-cli-current-viewer-payload.2026-06-29","status":"promoted","version":"0.2.25-lineage-payload.20260629"},"schema_version":1,"summary":{"boundary_count":1,"boundary_id":"bnd:graph.lineage-cli-current-viewer-payload.2026-06-29","boundary_ids":["bnd:graph.lineage-cli-current-viewer-payload.2026-06-29"],"claim_count":1,"evidence_count":1,"feature_count":1,"profile_count":0,"release_id":"rel:graph.lineage-cli-current-viewer-payload.2026-06-29","status":"promoted","test_count":1,"version":"0.2.25-lineage-payload.20260629"},"tests":[{"body":"Planned scaffold test for feat:graph.lineage-cli-current-viewer-payload T3 support.","claim_ids":["clm:graph.lineage-cli-current-viewer-payload.t3"],"evidence_ids":["evd:t3.graph.lineage-cli-current-viewer-payload.proof-graph","evd:t1.graph.lineage-cli-current-viewer-payload.proof-graph-source"],"execution":{"argv":["python","-m","pytest","tests/ssot_scaffold/test_graph_lineage_cli_current_viewer_payload_t3_proof_graph.py","-q"],"cwd":".","env":{},"mode":"command","success":{"expected":0,"type":"exit_code"},"timeout_seconds":600},"feature_ids":["feat:graph.lineage-cli-current-viewer-payload"],"id":"tst:pytest.graph.lineage-cli-current-viewer-payload.t3.proof-graph","kind":"pytest","origin":"ssot-core","path":"tests/ssot_scaffold/test_graph_lineage_cli_current_viewer_payload_t3_proof_graph.py","status":"passing","title":"Lineage graph CLI emits current viewer payload T3 proof-graph scaffold test"}]}